Name,Inventory Icon,Caption,Required Ingredient 1,Required Ingredient 2,Required Ingredient 3,Required Ingredient 4,Required Ingredient 5,Cooking Method,Effect,Effect Level,Effect Duration,Base Hearts Recovered,ActorName
Roasted Hylian Tomato,,"A Hylian tomato toasted whole.
It's juicy inside and will restore
more health when consumed.",Hylian Tomato,-,-,-,-,Fire,-,-,-,6,Item_Roast_54
Roasted Wildberry,,"This wildberry was prepared over an open
flame to alter its sweet taste. It recovers
more health than if eaten raw.",Wildberry,-,-,-,-,Fire,-,-,-,3,Item_Roast_07
Roasted Voltfruit,,"This voltfruit from the Gerudo Desert has
been charred to really bring out its sweet
and sour flavors.",Voltfruit,-,-,-,-,Fire,-,-,9000,3,Item_Roast_08
Roasted Hydromelon,,"This hydromelon was roasted whole for
a very soft and flaky inner flesh with a
rather intriguing flavor. Now this is your
money melon!",Hydromelon,-,-,-,-,Fire,-,-,9000,3,Item_Roast_12
Baked Palm Fruit,,"This palm fruit was broiled with direct heat,
resulting in steamed flesh inside the rind.
Best served at the moment the juices
emerge while roasting.",Palm Fruit,-,-,-,-,Fire,-,-,9000,6,Item_Roast_10
Roasted Mighty Bananas,,"These mighty bananas have been roasted
whole. Cooking them through has turned the
fruit inside into a sticky, rich, aromatic syrup.",Mighty Bananas,-,-,-,-,Fire,-,-,9000,3,Item_Roast_11
Roasted Lotus Seeds,,"Flame-roasted fleet-lotus seeds.
Peel the skin back to get to the soft
and flaky center.",Fleet-Lotus Seeds,-,-,-,-,Fire,-,-,-,3,Item_Roast_16
Roasted Mighty Thistle,,"Lightly toasted mighty thistle. It has no
special effects, but now that it's been grilled,
the pointy ends go down smooth.",Mighty Thistle,-,-,-,-,Fire,-,-,-,2,Item_Roast_27
Roasted Armoranth,,"Simple, roasted armoranth. The heat has
frayed the hard, chewy fiber just enough
to make it easy to eat.",Armoranth,-,-,-,-,Fire,-,-,-,2,Item_Roast_28
Roasted Swift Carrot,,"A fragrant swift carrot that's been
lightly roasted. It doesn't have any
special effects, but it will restore
some health.",Swift Carrot,-,-,-,-,Fire,-,-,-,3,Item_Roast_24
Roasted Endura Carrot,,"This flame-kissed endura carrot makes for a
truly extravagant single-item dish. The fire
really brought out its sweetness.",Endura Carrot,-,-,-,-,Fire,-,-,-,12,Item_Roast_50
Baked Fortified Pumpkin,,"This fortified pumpkin has been roasted
whole. The hard rind serves as a container
for the steamed pumpkin flesh inside.",Fortified Pumpkin,-,-,-,-,Fire,-,-,9000,3,Item_Roast_15
Baked Sun Pumpkin,,"A large, whole, roasted sun pumpkin. It lost
its original effect in the baking process, but
it's soft and tasty.",Sun Pumpkin,-,-,-,-,Fire,-,-,9000,3,Item_Roast_55
Roasted Radish,,"A roasted hearty radish. Fragrant and
warm, it has no special effect but will
restore hearts.",Hearty Radish,-,-,-,-,Fire,-,-,-,15,Item_Roast_18
Roasted Big Radish,,"A roasted big hearty radish.
To take such a precious vegetable
and put it to the fire is decadent
in a way.",Big Hearty Radish,-,-,-,-,Fire,-,-,-,24,Item_Roast_19
Toasty Skyshroom,,"A simply grilled skyshroom. The heat brings
out its flavor and increases the amount of
health it can restore.",Skyshroom,-,-,-,-,Fire,-,-,-,2,Item_Roast_56
Toasty Hylian Shroom,,"A Hylian shroom toasted to perfection.
The taste and fragrance are amplified,
restoring more health to its consumer.",Hylian Shroom,-,-,-,-,Fire,-,-,-,3,Item_Roast_06
Toasty Stamella Shroom,,"This toasted stamella shroom doesn't grant
any special effects, but it will restore
a bit of health.",Stamella Shroom,-,-,-,-,Fire,-,-,-,3,Item_Roast_04
Toasty Rushroom,,"A rushroom that's been put to the torch.
It may have lost its speedy properties, but
at least it tastes good now.",Rushroom,-,-,-,-,Fire,-,-,-,3,Item_Roast_36
Toasty Sunshroom,,"It's always a good idea to keep a fully
roasted sunshroom or two on hand just
in case. Eat it to recover a bit of health.",Sunshroom,-,-,-,-,Fire,-,-,-,3,Item_Roast_32
Toasty Chillshroom,,"A fully roasted chillshroom. It's evenly
toasted and tastes a lot better than
when eaten raw. Eating it will restore
a bit of health.",Chillshroom,-,-,-,-,Fire,-,-,-,3,Item_Roast_31
Toasty Zapshroom,,"It's not very shocking that this fully roasted
zapshroom is delicious. Eat it to recover
a bit of health.",Zapshroom,-,-,-,-,Fire,-,-,-,3,Item_Roast_33
Toasty Razorshroom,,"A razorshroom that's been exposed to
direct heat. Its sharp exterior has softened
considerably. Restores a bit of health.",Razorshroom,-,-,-,-,Fire,-,-,-,3,Item_Roast_37
Toasty Ironshroom,,"An ironshroom exposed to an open
flame. Its once-tough exterior is now crunchy
and tasty. Restores a bit of health.",Ironshroom,-,-,-,-,Fire,-,-,-,3,Item_Roast_38
Toasty Silent Shroom,,"A whole, toasted silent shroom. High heat
may have destroyed its soft glow, but it's
now fragrant and tasty.",Silent Shroom,-,-,-,-,Fire,-,-,-,3,Item_Roast_39
Toasty Brightcap,,"A whole, roasted brightcap. Sure, it loses its
bioluminescent enzymes, but it's softer and
easier to chew.",Brightcap,-,-,-,-,Fire,-,-,-,3,Item_Roast_58
Toasty Endura Shroom,,"A toasted endura shroom. It doesn't grant
any special effects, but boy is it tasty!",Endura Shroom,-,-,-,-,Fire,-,-,-,6,Item_Roast_53
Toasted Hearty Truffle,,"A hearty truffle toasted until its outside is
crispy. It tastes great, but hearty truffles are
far more effective when cooked in a recipe.",Hearty Truffle,-,-,-,-,Fire,-,-,-,12,Item_Roast_05
Toasted Big Hearty Truffle,,"This big hearty truffle has been roasted
whole. It gets full points for aroma and
nutrition. Eat it to recover a lot of hearts.",Big Hearty Truffle,-,-,-,-,Fire,-,-,-,18,Item_Roast_49
Seared Steak,,"Meat cooked over an open flame. Cooking it
has increased its flavor and the number of
hearts it provides.",Raw Meat,-,-,-,-,Fire,-,-,-,6,Item_Roast_01
Seared Prime Steak,,"Prime meat cooked over an open flame.
The outside is perfectly browned, while
the inside is mouthwateringly juicy.",Raw Prime Meat,-,-,-,-,Fire,-,-,-,9,Item_Roast_40
Seared Gourmet Steak,,"The highest quality gourmet meat, just
kissed by an open flame. No additional
seasonings have been added, which lets
the natural flavor of the meat really shine.",Raw Gourmet Meat,-,-,-,-,Fire,-,-,900,18,Item_Roast_45
Roasted Bird Drumstick,,"Bird drumstick that's been cooked to a crisp,
skin and all. It's devoid of seasoning,
but it has a simple, accessible taste.
Restores more hearts than the raw variety.",Raw Bird Drumstick,-,-,-,-,Fire,-,-,-,6,Item_Roast_02
Roasted Bird Thigh,,"Prime meat that's been flame-seared to
perfection. The outside is crispy, but the
inside is juicy. Eat it to recover hearts.",Raw Bird Thigh,-,-,-,-,Fire,-,-,-,9,Item_Roast_41
Roasted Whole Bird,,"This whole bird has been tickled by an open
flame to bring out its flavor. Less is more,
as the lack of additional seasoning allows
its natural taste to shine.",Raw Whole Bird,-,-,-,-,Fire,-,-,900,18,Item_Roast_46
Roasted Arowana,,"A whole, grilled ancient arowana. The meat is
cooked through and has reached a perfect
tenderness.",Ancient Arowana,-,-,-,-,Fire,-,-,-,6,Item_RoastFish_16
Roasted Bass,,"A bass that's been cooked whole over an
open flame. It's flaky and savory smelling.
Offers more hearts than the raw version.",Bass,-,-,-,-,Fire,-,-,-,6,Item_RoastFish_01
Roasted Trout,,"This trout can be found all over Hyrule.
Served river-to-table, it's simply cooked
for a soft and flaky flesh with a mild flavor.",Trout,-,-,-,-,Fire,-,-,9000,6,Item_RoastFish_03
Roasted Carp,,"Roasting this freshwater carp helped to
suppress some of its stench, making it
easier to stomach. You can really sink
your teeth into the thick, meaty flesh.",Carp,-,-,-,-,Fire,-,-,9000,6,Item_RoastFish_07
Roasted Porgy,,"The soft and fluffy texture of this seafaring
fish has been enhanced by roasting it over
an open fire. The crisp, aromatic skin is
particularly delicious.",Porgy,-,-,-,-,Fire,-,-,9000,6,Item_RoastFish_09
Roasted Cave Fish,,"A dish of grilled glowing cave fish. The fish's
loose meat is nicely cooked to give it both
excellent flavor and texture.",Glowing Cave Fish,-,-,-,-,Fire,-,-,-,6,Item_RoastFish_18
Roasted Hearty Bass,,"An open flame has crisped the skin of this
hearty bass to perfection. It's a sizable
portion and contains just the right amount
of fat to create an exceptionally tasty dish.",Hearty Bass,-,-,-,-,Fire,-,-,-,12,Item_RoastFish_02
Roasted Hearty Salmon,,"A fresh hearty salmon roasted simply over
an open flame without any additional
flavoring. Not only is the skin edible but
it gives off a rather nice aroma as well.",Hearty Salmon,-,-,-,-,Fire,-,-,9000,18,Item_RoastFish_04
Blackened Crab,,"A whole crab slow-roasted in its shell. The
soft, flaky flesh pairs nicely with the scent
of the charred shell for a meal that assaults
all five of your senses in all the best ways.",Crab,-,-,-,-,Fire,-,-,-,6,Item_RoastFish_15
Sneaky River Escargot,,"Sneaky river snail roasted whole in its shell.
The meat is soft and a little chewy. Pulling all
the meat from the shell in one go fills you
with a sense of accomplishment.",Sneaky River Snail,-,-,-,-,Fire,-,-,9000,6,Item_RoastFish_13
Roasted Tree Nut,,"A tree seed roasted to amplify its fragrance.
Gives more hearts than the raw variety.",Chickaloo Tree Nut,-,-,-,-,Fire,-,-,-,2,Item_Roast_52
Roasted Acorn,,"An acorn cooked with direct heat.
Its nutty aroma has been amplified.",Acorn,-,-,-,-,Fire,-,-,-,2,Item_Roast_48
Campfire Egg,,"Roasting a bird egg whole in its shell like this
helps retain water, making the egg a bit
chewier than usual.",Bird Egg,-,-,-,-,Fire,-,-,-,6,Item_Roast_51
Hard-Boiled Egg,,"A bird egg boiled using water from naturally
occurring hot springs. It's popular among
children and is easy to make.",Bird Egg,-,-,-,-,Hot Spring,-,-,-,6,Item_Boiled_01
Icy Meat,,"A frozen slab of animal meat. If you can
manage to chew it up and swallow it, you'll
restore some hearts and lower your body
temperature.",Raw Meat,-,-,-,-,Freeze,ResistHot,1,1800,4,Item_Chilled_01
Icy Prime Meat,,"High-quality, frozen animal meat. Doesn't
restore many hearts, but it can lower your
body temperature.",Raw Prime Meat,-,-,-,-,Freeze,ResistHot,1,1800,6,Item_Chilled_02
Icy Gourmet Meat,,"This raw gourmet meat has been frozen for
easy traveling. It's kept its flavor through the
freezing process. Eating it as is will provide
a temporary boost to your heat resistance.",Raw Gourmet Meat,-,-,-,-,Freeze,ResistHot,1,1800,12,Item_Chilled_03
Frozen Bird Drumstick,,"It's as hard as a rock but is supposedly
edible. It restores a small number of hearts
and has a cooling effect.",Raw Bird Drumstick,-,-,-,-,Freeze,ResistHot,1,1800,4,Item_Chilled_04
Frozen Bird Thigh,,"High-quality, frozen bird meat. It's so solid it
looks like it could be used as a weapon.
Eating it will restore some hearts and cool
you down, but don't break your teeth on it.",Raw Bird Thigh,-,-,-,-,Freeze,ResistHot,1,1800,6,Item_Chilled_05
Frozen Whole Bird,,"This raw whole bird may have been
frozen solid, but its flavor remains intact.
Eating it will provide a temporary boost
to your heat resistance.",Raw Whole Bird,-,-,-,-,Freeze,ResistHot,1,1800,12,Item_Chilled_06
Frozen Arowana,,"Being frozen has condensed the taste
of fish inside this arowana's body. Eating it
will provide a temporary boost to your
heat resistance.",Ancient Arowana,-,-,-,-,Freeze,ResistHot,1,1800,8,Item_ChilledFish_16
Frozen Bass,,"That's one cold fish. Eating it won't restore
many hearts, but it will lower your body
temperature a bit.",Bass,-,-,-,-,Freeze,ResistHot,1,1800,8,Item_ChilledFish_01
Frozen Trout,,"Being frozen has condensed the taste
of fish inside this trout's body. Eating it
will provide a temporary boost to your
heat resistance.",Trout,-,-,-,-,Freeze,ResistHot,1,1800,4,Item_ChilledFish_03
Frozen Carp,,"The crunchy, icy texture of this chilled
carp is quite the delicacy. Eating it will
temporarily increase your heat resistance.",Carp,-,-,-,-,Freeze,ResistHot,1,1800,4,Item_ChilledFish_04
Frozen Porgy,,"This frozen porgy is the ideal snack for hiking
through hot climates like the Gerudo Desert.
Eating it provides a temporary boost to your
heat resistance.",Porgy,-,-,-,-,Freeze,ResistHot,1,1800,4,Item_ChilledFish_05
Frozen Cave Fish,,"A frozen glowing cave fish is just easier to
eat than an unfrozen one. And, once eaten, it
makes heat more bearable for a short time.",Glowing Cave Fish,-,-,-,-,Freeze,ResistHot,1,1800,8,Item_ChilledFish_18
Frozen Hearty Bass,,"This hearty bass has been frozen by cold air.
Eating it will be a challenge because it's
frozen solid, but if you persevere, it will
temporarily increase your heat resistance.",Hearty Bass,-,-,-,-,Freeze,ResistHot,1,1800,8,Item_ChilledFish_06
Frozen Hearty Salmon,,"This salmon doesn't taste quite as fishy
because the excess fat has been removed.
It's exceptionally cold, so eating it provides
a temporary boost to heat resistance.",Hearty Salmon,-,-,-,-,Freeze,ResistHot,1,1800,16,Item_ChilledFish_02
Frozen Crab,,"Doesn't provide as much companionship as
an unfrozen crab, but it won't spoil during
your travels. Eat it to gain a temporary boost
to your heat resistance.",Bright-Eyed Crab,-,-,-,-,Freeze,ResistHot,1,1800,8,Item_ChilledFish_07
Frozen River Snail,,"The distinct glow of this sneaky river snail
has diminished after it's been frozen, but
eating it like this will provide a temporary
increase to your heat resistance.",Sneaky River Snail,-,-,-,-,Freeze,ResistHot,1,1800,4,Item_ChilledFish_08
Energizing Elixir,,"Restores your stamina, which is used when
performing physical actions such as 
climbing walls or swimming.",Enemy,Energetic Rhino Beetle / Restless Cricket,-,-,-,Cooking Pot,Stamina,1 - 2,-,-,Item_Cook_C_17_StaminaRecover
Hasty Elixir,,"Grants a low-level haste effect, which
boosts your movement speed while
running, swimming, or climbing.",Enemy,Hot-Footed Frog / Hightail Lizard,-,-,-,Cooking Pot,SpeedUp,1 - 3,-,-,Item_Cook_C_17_AllSpeed
Spicy Elixir,,"Grants a low-level warming effect, increasing
your resistance to cold environments. Very
useful when exploring snow-covered
mountains.",Enemy,Summerwing Butterfly / Warm Darner,-,-,-,Cooking Pot,ResistCold,1 - 2,-,-,Item_Cook_C_17_ResistCold
Chilly Elixir,,"Grants a low-level cooling effect, raising
your body's resistance to heat. Crucial for
long journeys through the desert.",Enemy,Winterwing Butterfly / Cold Darner,-,-,-,Cooking Pot,ResistHot,1 - 2,-,-,Item_Cook_C_17_ResistHot
Electro Elixir,,"Grants a low-level resistance to electricity.
Useful against enemies with electrical
attacks.",Enemy,Thunderwing Butterfly / Electric Darner,-,-,-,Cooking Pot,ResistElectric,1 - 3,-,-,Item_Cook_C_17_ResistElectric
Fireproof Elixir,,"Grants a fireproof effect, which prevents your
body from catching fire.
Be sure to pack this when venturing out
to explore caves in Death Mountain.",Enemy,Smotherwing Butterfly / Fireproof Lizard,-,-,-,Cooking Pot,ResistBurn,1 - 2,-,-,Item_Cook_C_17_ResistBurn
Mighty Elixir,,"Grants a low-level might effect, which
strengthens your body and mind to boost
your attack power with all weapons.",Enemy,Bladed Rhino Beetle,-,-,-,Cooking Pot,AttackUp,1 - 3,-,-,Item_Cook_C_17_AttackUp
Tough Elixir,,"Grants a low-level toughness effect, which
fortifies your bones to strengthen your
defense. Best to use before facing off
against hard-hitting enemies.",Enemy,Rugged Rhino Beetle,-,-,-,Cooking Pot,DefenseUp,1 - 3,-,-,Item_Cook_C_17_DefenseUp
Sneaky Elixir,,"Grants a low-level stealth effect, which
calms the nerves and silences footfalls.
Allows you to move about undetected by
monsters and animals.",Enemy,Sunset Firefly,-,-,-,Cooking Pot,Silent,1 - 3,-,-,Item_Cook_C_17_QuietnessUp
Sticky Elixir,,"Grants a low-level slip resistance to keep you
from slipping on wet surfaces. Its highly
absorptive ingredients make it a must-have
for sudden rainfalls.",Enemy,Sticky Frog / Sticky Lizard,-,-,-,Cooking Pot,ResistSlip,1 - 3,-,-,Item_Cook_C_17_NotSlippy
Bright Elixir,,"Grants a low-level glow effect, illuminating
your immediate surroundings. This faint
luminescence is a boon in dark places.",Enemy,Deep Firefly,-,-,-,Cooking Pot,Light,1 - 3,-,-,Item_Cook_C_17_LightEmission
Enduring Elixir,,"Restores stamina and temporarily extends
your Stamina Wheel. The additional stamina
will disappear as it's used.",Enemy,Tireless Frog,-,-,-,Cooking Pot,Guts,-,-,-,Item_Cook_C_17_ExStaminaMaxUp
Hearty Elixir,,"Restores you to full health and increases
your maximum hearts. The additional hearts
are lost as you take damage.",Enemy,Hearty Lizard,-,-,-,Cooking Pot,MaxLife,-,-,All,Item_Cook_C_17_LifeMaxUp
Fairy Tonic,,"This powerful recovery elixir harnesses the
power of fairies. It has a sweet fragrance.",Fairy,-,-,-,-,Cooking Pot,-,-,-,-,Item_Cook_C_16